00:1c.0 PCI bridge: Intel Corporation Device 54b9 (prog-if 00 [Normal decode])
        Subsystem: Intel Corporation Device 7270
        Control: I/O+ Mem+ BusMaster+ SpecCycle- MemWINV- VGASnoop- ParErr- Stepping- SERR- FastB2B- DisINTx+
        Status: Cap+ 66MHz- UDF- FastB2B- ParErr- DEVSEL=fast >TAbort- <TAbort- <MAbort- >SERR- <PERR- INTx-
        Latency: 0, Cache Line Size: 64 bytes
        Interrupt: pin B routed to IRQ 122
        Bus: primary=00, secondary=01, subordinate=01, sec-latency=0
        I/O behind bridge: [disabled] [16-bit]
        Memory behind bridge: 81800000-818fffff [size=1M] [32-bit]
        Prefetchable memory behind bridge: [disabled] [64-bit]
        Secondary status: 66MHz- FastB2B- ParErr- DEVSEL=fast >TAbort- <TAbort- <MAbort+ <SERR- <PERR-
        BridgeCtl: Parity- SERR+ NoISA- VGA- VGA16+ MAbort- >Reset- FastB2B-
                PriDiscTmr- SecDiscTmr- DiscTmrStat- DiscTmrSERREn-
        Capabilities: [40] Express (v2) Root Port (Slot+), IntMsgNum 0
                DevCap: MaxPayload 256 bytes, PhantFunc 0
                        ExtTag- RBE+ TEE-IO-
                DevCtl: CorrErr- NonFatalErr- FatalErr- UnsupReq-
                        RlxdOrd- ExtTag- PhantFunc- AuxPwr- NoSnoop-
                        MaxPayload 256 bytes, MaxReadReq 128 bytes
                DevSta: CorrErr- NonFatalErr- FatalErr- UnsupReq- AuxPwr+ TransPend-
                LnkCap: Port #2, Speed 8GT/s, Width x1, ASPM L1, Exit Latency L1 <16us
                        ClockPM- Surprise- LLActRep+ BwNot+ ASPMOptComp+
                LnkCtl: ASPM L1 Enabled; RCB 64 bytes, LnkDisable- CommClk+
                        ExtSynch- ClockPM- AutWidDis- BWInt- AutBWInt-
                LnkSta: Speed 8GT/s, Width x1
                        TrErr- Train- SlotClk+ DLActive+ BWMgmt+ ABWMgmt-
                SltCap: AttnBtn- PwrCtrl- MRL- AttnInd- PwrInd- HotPlug- Surprise-
                        Slot #5, PowerLimit 10W; Interlock- NoCompl+
                SltCtl: Enable: AttnBtn- PwrFlt- MRL- PresDet- CmdCplt- HPIrq- LinkChg-
                        Control: AttnInd Unknown, PwrInd Unknown, Power- Interlock-
                SltSta: Status: AttnBtn- PowerFlt- MRL- CmdCplt- PresDet+ Interlock-
                        Changed: MRL- PresDet- LinkState-
                RootCap: CRSVisible-
                RootCtl: ErrCorrectable- ErrNon-Fatal- ErrFatal- PMEIntEna- CRSVisible-
                RootSta: PME ReqID 0000, PMEStatus- PMEPending-
                DevCap2: Completion Timeout: Range ABC, TimeoutDis+ NROPrPrP- LTR+
                         10BitTagComp- 10BitTagReq- OBFF Via WAKE#, ExtFmt- EETLPPrefix-
                         EmergencyPowerReduction Not Supported, EmergencyPowerReductionInit-
                         FRS- LN System CLS Not Supported, TPHComp- ExtTPHComp- ARIFwd+
                         AtomicOpsCap: Routing- 32bit- 64bit- 128bitCAS-
                DevCtl2: Completion Timeout: 50us to 50ms, TimeoutDis- ARIFwd-
                         AtomicOpsCtl: ReqEn- EgressBlck-
                         IDOReq- IDOCompl- LTR+ EmergencyPowerReductionReq-
                         10BitTagReq- OBFF Disabled, EETLPPrefixBlk-
                LnkCap2: Supported Link Speeds: 2.5-8GT/s, Crosslink- Retimer- 2Retimers- DRS-
                LnkCtl2: Target Link Speed: 8GT/s, EnterCompliance- SpeedDis-
                         Transmit Margin: Normal Operating Range, EnterModifiedCompliance- ComplianceSOS-
                         Compliance Preset/De-emphasis: -6dB de-emphasis, 0dB preshoot
                LnkSta2: Current De-emphasis Level: -3.5dB, EqualizationComplete+ EqualizationPhase1+
                         EqualizationPhase2+ EqualizationPhase3+ LinkEqualizationRequest-
                         Retimer- 2Retimers- CrosslinkRes: unsupported
        Capabilities: [80] MSI: Enable+ Count=1/1 Maskable- 64bit-
                Address: fee00218  Data: 0000
        Capabilities: [90] Subsystem: Intel Corporation Device 7270
        Capabilities: [a0] Power Management version 3
                Flags: PMEClk- DSI- D1- D2- AuxCurrent=0mA PME(D0+,D1-,D2-,D3hot+,D3cold+)
                Status: D0 NoSoftRst- PME-Enable- DSel=0 DScale=0 PME-
        Kernel driver in use: pcieport
00:1c.2 PCI bridge: Intel Corporation Device 54ba (prog-if 00 [Normal decode])
        Subsystem: Intel Corporation Device 7270
        Control: I/O+ Mem+ BusMaster+ SpecCycle- MemWINV- VGASnoop- ParErr- Stepping- SERR- FastB2B- DisINTx+
        Status: Cap+ 66MHz- UDF- FastB2B- ParErr- DEVSEL=fast >TAbort- <TAbort- <MAbort- >SERR- <PERR- INTx-
        Latency: 0, Cache Line Size: 64 bytes
        Interrupt: pin C routed to IRQ 123
        Bus: primary=00, secondary=02, subordinate=02, sec-latency=0
        I/O behind bridge: [disabled] [16-bit]
        Memory behind bridge: 81500000-817fffff [size=3M] [32-bit]
        Prefetchable memory behind bridge: [disabled] [64-bit]
        Secondary status: 66MHz- FastB2B- ParErr- DEVSEL=fast >TAbort- <TAbort- <MAbort+ <SERR- <PERR-
        BridgeCtl: Parity- SERR+ NoISA- VGA- VGA16+ MAbort- >Reset- FastB2B-
                PriDiscTmr- SecDiscTmr- DiscTmrStat- DiscTmrSERREn-
        Capabilities: [40] Express (v2) Root Port (Slot+), IntMsgNum 0
                DevCap: MaxPayload 256 bytes, PhantFunc 0
                        ExtTag- RBE+ TEE-IO-
                DevCtl: CorrErr- NonFatalErr- FatalErr- UnsupReq-
                        RlxdOrd- ExtTag- PhantFunc- AuxPwr- NoSnoop-
                        MaxPayload 256 bytes, MaxReadReq 128 bytes
                DevSta: CorrErr- NonFatalErr- FatalErr- UnsupReq- AuxPwr+ TransPend-
                LnkCap: Port #3, Speed 8GT/s, Width x1, ASPM L1, Exit Latency L1 <16us
                        ClockPM- Surprise- LLActRep+ BwNot+ ASPMOptComp+
                LnkCtl: ASPM L1 Enabled; RCB 64 bytes, LnkDisable- CommClk+
                        ExtSynch- ClockPM- AutWidDis- BWInt- AutBWInt-
                LnkSta: Speed 5GT/s, Width x1
                        TrErr- Train- SlotClk+ DLActive+ BWMgmt+ ABWMgmt-
                SltCap: AttnBtn- PwrCtrl- MRL- AttnInd- PwrInd- HotPlug- Surprise-
                        Slot #6, PowerLimit 10W; Interlock- NoCompl+
                SltCtl: Enable: AttnBtn- PwrFlt- MRL- PresDet- CmdCplt- HPIrq- LinkChg-
                        Control: AttnInd Unknown, PwrInd Unknown, Power- Interlock-
                SltSta: Status: AttnBtn- PowerFlt- MRL- CmdCplt- PresDet+ Interlock-
                        Changed: MRL- PresDet- LinkState-
                RootCap: CRSVisible-
                RootCtl: ErrCorrectable- ErrNon-Fatal- ErrFatal- PMEIntEna- CRSVisible-
                RootSta: PME ReqID 0000, PMEStatus- PMEPending-
                DevCap2: Completion Timeout: Range ABC, TimeoutDis+ NROPrPrP- LTR+
                         10BitTagComp- 10BitTagReq- OBFF Via WAKE#, ExtFmt- EETLPPrefix-
                         EmergencyPowerReduction Not Supported, EmergencyPowerReductionInit-
                         FRS- LN System CLS Not Supported, TPHComp- ExtTPHComp- ARIFwd+
                         AtomicOpsCap: Routing- 32bit- 64bit- 128bitCAS-
                DevCtl2: Completion Timeout: 50us to 50ms, TimeoutDis- ARIFwd-
                         AtomicOpsCtl: ReqEn- EgressBlck-
                         IDOReq- IDOCompl- LTR+ EmergencyPowerReductionReq-
                         10BitTagReq- OBFF Disabled, EETLPPrefixBlk-
                LnkCap2: Supported Link Speeds: 2.5-8GT/s, Crosslink- Retimer- 2Retimers- DRS-
                LnkCtl2: Target Link Speed: 5GT/s, EnterCompliance- SpeedDis-
                         Transmit Margin: Normal Operating Range, EnterModifiedCompliance- ComplianceSOS-
                         Compliance Preset/De-emphasis: -6dB de-emphasis, 0dB preshoot
                LnkSta2: Current De-emphasis Level: -6dB, EqualizationComplete- EqualizationPhase1-
                         EqualizationPhase2- EqualizationPhase3- LinkEqualizationRequest-
                         Retimer- 2Retimers- CrosslinkRes: unsupported
        Capabilities: [80] MSI: Enable+ Count=1/1 Maskable- 64bit-
                Address: fee00258  Data: 0000
        Capabilities: [90] Subsystem: Intel Corporation Device 7270
        Capabilities: [a0] Power Management version 3
                Flags: PMEClk- DSI- D1- D2- AuxCurrent=0mA PME(D0+,D1-,D2-,D3hot+,D3cold+)
                Status: D0 NoSoftRst- PME-Enable- DSel=0 DScale=0 PME-
        Kernel driver in use: pcieport
00:1c.3 PCI bridge: Intel Corporation Device 54bb (prog-if 00 [Normal decode])
        Subsystem: Intel Corporation Device 7270
        Control: I/O+ Mem+ BusMaster+ SpecCycle- MemWINV- VGASnoop- ParErr- Stepping- SERR- FastB2B- DisINTx+
        Status: Cap+ 66MHz- UDF- FastB2B- ParErr- DEVSEL=fast >TAbort- <TAbort- <MAbort- >SERR- <PERR- INTx-
        Latency: 0, Cache Line Size: 64 bytes
        Interrupt: pin D routed to IRQ 124
        Bus: primary=00, secondary=03, subordinate=03, sec-latency=0
        I/O behind bridge: [disabled] [16-bit]
        Memory behind bridge: 81200000-814fffff [size=3M] [32-bit]
        Prefetchable memory behind bridge: [disabled] [64-bit]
        Secondary status: 66MHz- FastB2B- ParErr- DEVSEL=fast >TAbort- <TAbort- <MAbort+ <SERR- <PERR-
        BridgeCtl: Parity- SERR+ NoISA- VGA- VGA16+ MAbort- >Reset- FastB2B-
                PriDiscTmr- SecDiscTmr- DiscTmrStat- DiscTmrSERREn-
        Capabilities: [40] Express (v2) Root Port (Slot+), IntMsgNum 0
                DevCap: MaxPayload 256 bytes, PhantFunc 0
                        ExtTag- RBE+ TEE-IO-
                DevCtl: CorrErr- NonFatalErr- FatalErr- UnsupReq-
                        RlxdOrd- ExtTag- PhantFunc- AuxPwr- NoSnoop-
                        MaxPayload 256 bytes, MaxReadReq 128 bytes
                DevSta: CorrErr- NonFatalErr- FatalErr- UnsupReq- AuxPwr+ TransPend-
                LnkCap: Port #4, Speed 8GT/s, Width x1, ASPM L1, Exit Latency L1 <16us
                        ClockPM- Surprise- LLActRep+ BwNot+ ASPMOptComp+
                LnkCtl: ASPM L1 Enabled; RCB 64 bytes, LnkDisable- CommClk+
                        ExtSynch- ClockPM- AutWidDis- BWInt- AutBWInt-
                LnkSta: Speed 5GT/s, Width x1
                        TrErr- Train- SlotClk+ DLActive+ BWMgmt+ ABWMgmt-
                SltCap: AttnBtn- PwrCtrl- MRL- AttnInd- PwrInd- HotPlug- Surprise-
                        Slot #7, PowerLimit 10W; Interlock- NoCompl+
                SltCtl: Enable: AttnBtn- PwrFlt- MRL- PresDet- CmdCplt- HPIrq- LinkChg-
                        Control: AttnInd Unknown, PwrInd Unknown, Power- Interlock-
                SltSta: Status: AttnBtn- PowerFlt- MRL- CmdCplt- PresDet+ Interlock-
                        Changed: MRL- PresDet- LinkState-
                RootCap: CRSVisible-
                RootCtl: ErrCorrectable- ErrNon-Fatal- ErrFatal- PMEIntEna- CRSVisible-
                RootSta: PME ReqID 0000, PMEStatus- PMEPending-
                DevCap2: Completion Timeout: Range ABC, TimeoutDis+ NROPrPrP- LTR+
                         10BitTagComp- 10BitTagReq- OBFF Via WAKE#, ExtFmt- EETLPPrefix-
                         EmergencyPowerReduction Not Supported, EmergencyPowerReductionInit-
                         FRS- LN System CLS Not Supported, TPHComp- ExtTPHComp- ARIFwd+
                         AtomicOpsCap: Routing- 32bit- 64bit- 128bitCAS-
                DevCtl2: Completion Timeout: 50us to 50ms, TimeoutDis- ARIFwd-
                         AtomicOpsCtl: ReqEn- EgressBlck-
                         IDOReq- IDOCompl- LTR+ EmergencyPowerReductionReq-
                         10BitTagReq- OBFF Disabled, EETLPPrefixBlk-
                LnkCap2: Supported Link Speeds: 2.5-8GT/s, Crosslink- Retimer- 2Retimers- DRS-
                LnkCtl2: Target Link Speed: 5GT/s, EnterCompliance- SpeedDis-
                         Transmit Margin: Normal Operating Range, EnterModifiedCompliance- ComplianceSOS-
                         Compliance Preset/De-emphasis: -6dB de-emphasis, 0dB preshoot
                LnkSta2: Current De-emphasis Level: -6dB, EqualizationComplete- EqualizationPhase1-
                         EqualizationPhase2- EqualizationPhase3- LinkEqualizationRequest-
                         Retimer- 2Retimers- CrosslinkRes: unsupported
        Capabilities: [80] MSI: Enable+ Count=1/1 Maskable- 64bit-
                Address: fee00298  Data: 0000
        Capabilities: [90] Subsystem: Intel Corporation Device 7270
        Capabilities: [a0] Power Management version 3
                Flags: PMEClk- DSI- D1- D2- AuxCurrent=0mA PME(D0+,D1-,D2-,D3hot+,D3cold+)
                Status: D0 NoSoftRst- PME-Enable- DSel=0 DScale=0 PME-
        Kernel driver in use: pcieport
00:1d.0 PCI bridge: Intel Corporation Alder Lake-N PCI Express Root Port #9 (prog-if 00 [Normal decode])
        Subsystem: Intel Corporation Device 7270
        Control: I/O+ Mem+ BusMaster+ SpecCycle- MemWINV- VGASnoop- ParErr- Stepping- SERR- FastB2B- DisINTx+
        Status: Cap+ 66MHz- UDF- FastB2B- ParErr- DEVSEL=fast >TAbort- <TAbort- <MAbort- >SERR- <PERR- INTx-
        Latency: 0, Cache Line Size: 64 bytes
        Interrupt: pin A routed to IRQ 125
        Bus: primary=00, secondary=04, subordinate=04, sec-latency=0
        I/O behind bridge: [disabled] [16-bit]
        Memory behind bridge: 80c00000-810fffff [size=5M] [32-bit]
        Prefetchable memory behind bridge: [disabled] [64-bit]
        Secondary status: 66MHz- FastB2B- ParErr- DEVSEL=fast >TAbort- <TAbort- <MAbort+ <SERR- <PERR-
        BridgeCtl: Parity- SERR+ NoISA- VGA- VGA16+ MAbort- >Reset- FastB2B-
                PriDiscTmr- SecDiscTmr- DiscTmrStat- DiscTmrSERREn-
        Capabilities: [40] Express (v2) Root Port (Slot+), IntMsgNum 0
                DevCap: MaxPayload 256 bytes, PhantFunc 0
                        ExtTag- RBE+ TEE-IO-
                DevCtl: CorrErr- NonFatalErr- FatalErr- UnsupReq-
                        RlxdOrd- ExtTag- PhantFunc- AuxPwr- NoSnoop-
                        MaxPayload 256 bytes, MaxReadReq 128 bytes
                DevSta: CorrErr- NonFatalErr- FatalErr- UnsupReq- AuxPwr+ TransPend-
                LnkCap: Port #9, Speed 8GT/s, Width x2, ASPM L1, Exit Latency L1 <16us
                        ClockPM- Surprise- LLActRep+ BwNot+ ASPMOptComp+
                LnkCtl: ASPM L1 Enabled; RCB 64 bytes, LnkDisable- CommClk+
                        ExtSynch- ClockPM- AutWidDis- BWInt- AutBWInt-
                LnkSta: Speed 8GT/s, Width x2
                        TrErr- Train- SlotClk+ DLActive+ BWMgmt+ ABWMgmt-
                SltCap: AttnBtn- PwrCtrl- MRL- AttnInd- PwrInd- HotPlug- Surprise-
                        Slot #12, PowerLimit 25W; Interlock- NoCompl+
                SltCtl: Enable: AttnBtn- PwrFlt- MRL- PresDet- CmdCplt- HPIrq- LinkChg-
                        Control: AttnInd Unknown, PwrInd Unknown, Power- Interlock-
                SltSta: Status: AttnBtn- PowerFlt- MRL- CmdCplt- PresDet+ Interlock-
                        Changed: MRL- PresDet- LinkState-
                RootCap: CRSVisible-
                RootCtl: ErrCorrectable- ErrNon-Fatal- ErrFatal- PMEIntEna- CRSVisible-
                RootSta: PME ReqID 0000, PMEStatus- PMEPending-
                DevCap2: Completion Timeout: Range ABC, TimeoutDis+ NROPrPrP- LTR+
                         10BitTagComp- 10BitTagReq- OBFF Via WAKE#, ExtFmt- EETLPPrefix-
                         EmergencyPowerReduction Not Supported, EmergencyPowerReductionInit-
                         FRS- LN System CLS Not Supported, TPHComp- ExtTPHComp- ARIFwd+
                         AtomicOpsCap: Routing- 32bit- 64bit- 128bitCAS-
                DevCtl2: Completion Timeout: 50us to 50ms, TimeoutDis- ARIFwd-
                         AtomicOpsCtl: ReqEn- EgressBlck-
                         IDOReq- IDOCompl- LTR+ EmergencyPowerReductionReq-
                         10BitTagReq- OBFF Disabled, EETLPPrefixBlk-
                LnkCap2: Supported Link Speeds: 2.5-8GT/s, Crosslink- Retimer- 2Retimers- DRS-
                LnkCtl2: Target Link Speed: 8GT/s, EnterCompliance- SpeedDis-
                         Transmit Margin: Normal Operating Range, EnterModifiedCompliance- ComplianceSOS-
                         Compliance Preset/De-emphasis: -6dB de-emphasis, 0dB preshoot
                LnkSta2: Current De-emphasis Level: -3.5dB, EqualizationComplete+ EqualizationPhase1+
                         EqualizationPhase2+ EqualizationPhase3+ LinkEqualizationRequest-
                         Retimer- 2Retimers- CrosslinkRes: unsupported
        Capabilities: [80] MSI: Enable+ Count=1/1 Maskable- 64bit-
                Address: fee002d8  Data: 0000
        Capabilities: [90] Subsystem: Intel Corporation Device 7270
        Capabilities: [a0] Power Management version 3
                Flags: PMEClk- DSI- D1- D2- AuxCurrent=0mA PME(D0+,D1-,D2-,D3hot+,D3cold+)
                Status: D0 NoSoftRst- PME-Enable- DSel=0 DScale=0 PME-
        Kernel driver in use: pcieport
00:1d.2 PCI bridge: Intel Corporation Alder Lake-N PCI Express Root Port #11 (prog-if 00 [Normal decode])
        Subsystem: Intel Corporation Device 7270
        Control: I/O+ Mem+ BusMaster+ SpecCycle- MemWINV- VGASnoop- ParErr- Stepping- SERR- FastB2B- DisINTx+
        Status: Cap+ 66MHz- UDF- FastB2B- ParErr- DEVSEL=fast >TAbort- <TAbort- <MAbort- >SERR- <PERR- INTx-
        Latency: 0, Cache Line Size: 64 bytes
        Interrupt: pin C routed to IRQ 126
        Bus: primary=00, secondary=05, subordinate=05, sec-latency=0
        I/O behind bridge: [disabled] [16-bit]
        Memory behind bridge: 80400000-808fffff [size=5M] [32-bit]
        Prefetchable memory behind bridge: [disabled] [64-bit]
        Secondary status: 66MHz- FastB2B- ParErr- DEVSEL=fast >TAbort- <TAbort- <MAbort+ <SERR- <PERR-
        BridgeCtl: Parity- SERR+ NoISA- VGA- VGA16+ MAbort- >Reset- FastB2B-
                PriDiscTmr- SecDiscTmr- DiscTmrStat- DiscTmrSERREn-
        Capabilities: [40] Express (v2) Root Port (Slot+), IntMsgNum 0
                DevCap: MaxPayload 256 bytes, PhantFunc 0
                        ExtTag- RBE+ TEE-IO-
                DevCtl: CorrErr- NonFatalErr- FatalErr- UnsupReq-
                        RlxdOrd- ExtTag- PhantFunc- AuxPwr- NoSnoop-
                        MaxPayload 256 bytes, MaxReadReq 128 bytes
                DevSta: CorrErr- NonFatalErr- FatalErr- UnsupReq- AuxPwr+ TransPend-
                LnkCap: Port #11, Speed 8GT/s, Width x2, ASPM L1, Exit Latency L1 <16us
                        ClockPM- Surprise- LLActRep+ BwNot+ ASPMOptComp+
                LnkCtl: ASPM L1 Enabled; RCB 64 bytes, LnkDisable- CommClk+
                        ExtSynch- ClockPM- AutWidDis- BWInt- AutBWInt-
                LnkSta: Speed 8GT/s, Width x2
                        TrErr- Train- SlotClk+ DLActive+ BWMgmt+ ABWMgmt-
                SltCap: AttnBtn- PwrCtrl- MRL- AttnInd- PwrInd- HotPlug- Surprise-
                        Slot #14, PowerLimit 25W; Interlock- NoCompl+
                SltCtl: Enable: AttnBtn- PwrFlt- MRL- PresDet- CmdCplt- HPIrq- LinkChg-
                        Control: AttnInd Unknown, PwrInd Unknown, Power- Interlock-
                SltSta: Status: AttnBtn- PowerFlt- MRL- CmdCplt- PresDet+ Interlock-
                        Changed: MRL- PresDet- LinkState-
                RootCap: CRSVisible-
                RootCtl: ErrCorrectable- ErrNon-Fatal- ErrFatal- PMEIntEna- CRSVisible-
                RootSta: PME ReqID 0000, PMEStatus- PMEPending-
                DevCap2: Completion Timeout: Range ABC, TimeoutDis+ NROPrPrP- LTR+
                         10BitTagComp- 10BitTagReq- OBFF Via WAKE#, ExtFmt- EETLPPrefix-
                         EmergencyPowerReduction Not Supported, EmergencyPowerReductionInit-
                         FRS- LN System CLS Not Supported, TPHComp- ExtTPHComp- ARIFwd+
                         AtomicOpsCap: Routing- 32bit- 64bit- 128bitCAS-
                DevCtl2: Completion Timeout: 50us to 50ms, TimeoutDis- ARIFwd-
                         AtomicOpsCtl: ReqEn- EgressBlck-
                         IDOReq- IDOCompl- LTR+ EmergencyPowerReductionReq-
                         10BitTagReq- OBFF Disabled, EETLPPrefixBlk-
                LnkCap2: Supported Link Speeds: 2.5-8GT/s, Crosslink- Retimer- 2Retimers- DRS-
                LnkCtl2: Target Link Speed: 8GT/s, EnterCompliance- SpeedDis-
                         Transmit Margin: Normal Operating Range, EnterModifiedCompliance- ComplianceSOS-
                         Compliance Preset/De-emphasis: -6dB de-emphasis, 0dB preshoot
                LnkSta2: Current De-emphasis Level: -3.5dB, EqualizationComplete+ EqualizationPhase1+
                         EqualizationPhase2+ EqualizationPhase3+ LinkEqualizationRequest-
                         Retimer- 2Retimers- CrosslinkRes: unsupported
        Capabilities: [80] MSI: Enable+ Count=1/1 Maskable- 64bit-
                Address: fee002f8  Data: 0000
        Capabilities: [90] Subsystem: Intel Corporation Device 7270
        Capabilities: [a0] Power Management version 3
                Flags: PMEClk- DSI- D1- D2- AuxCurrent=0mA PME(D0+,D1-,D2-,D3hot+,D3cold+)
                Status: D0 NoSoftRst- PME-Enable- DSel=0 DScale=0 PME-
        Kernel driver in use: pcieport
01:00.0 Non-Volatile memory controller: Samsung Electronics Co Ltd NVMe SSD Controller SM961/PM961/SM963 (prog-if 02 [NVM Express])
        Subsystem: Samsung Electronics Co Ltd SM963 2.5" NVMe PCIe SSD
        Control: I/O- Mem+ BusMaster+ SpecCycle- MemWINV- VGASnoop- ParErr- Stepping- SERR- FastB2B- DisINTx+
        Status: Cap+ 66MHz- UDF- FastB2B- ParErr- DEVSEL=fast >TAbort+ <TAbort- <MAbort- >SERR- <PERR- INTx-
        Latency: 0, Cache Line Size: 64 bytes
        Interrupt: pin A routed to IRQ 17
        Region 0: Memory at 81800000 (64-bit, non-prefetchable) [size=16K]
        Capabilities: [40] Power Management version 3
                Flags: PMEClk- DSI- D1- D2- AuxCurrent=0mA PME(D0-,D1-,D2-,D3hot-,D3cold-)
                Status: D0 NoSoftRst+ PME-Enable- DSel=0 DScale=0 PME-
        Capabilities: [50] MSI: Enable- Count=1/32 Maskable- 64bit+
                Address: 0000000000000000  Data: 0000
        Capabilities: [70] Express (v2) Endpoint, IntMsgNum 0
                DevCap: MaxPayload 256 bytes, PhantFunc 0, Latency L0s unlimited, L1 unlimited
                        ExtTag- AttnBtn- AttnInd- PwrInd- RBE+ FLReset+ SlotPowerLimit 10W TEE-IO-
                DevCtl: CorrErr- NonFatalErr- FatalErr- UnsupReq-
                        RlxdOrd+ ExtTag- PhantFunc- AuxPwr- NoSnoop+ FLReset-
                        MaxPayload 256 bytes, MaxReadReq 512 bytes
                DevSta: CorrErr- NonFatalErr- FatalErr- UnsupReq- AuxPwr+ TransPend-
                LnkCap: Port #0, Speed 8GT/s, Width x4, ASPM L1, Exit Latency L1 <64us
                        ClockPM+ Surprise- LLActRep- BwNot- ASPMOptComp+
                LnkCtl: ASPM L1 Enabled; RCB 64 bytes, LnkDisable- CommClk+
                        ExtSynch- ClockPM+ AutWidDis- BWInt- AutBWInt-
                LnkSta: Speed 8GT/s, Width x1 (downgraded)
                        TrErr- Train- SlotClk+ DLActive- BWMgmt- ABWMgmt-
                DevCap2: Completion Timeout: Range ABCD, TimeoutDis+ NROPrPrP- LTR+
                         10BitTagComp- 10BitTagReq- OBFF Not Supported, ExtFmt- EETLPPrefix-
                         EmergencyPowerReduction Not Supported, EmergencyPowerReductionInit-
                         FRS- TPHComp- ExtTPHComp-
                         AtomicOpsCap: 32bit- 64bit- 128bitCAS-
                DevCtl2: Completion Timeout: 50us to 50ms, TimeoutDis-
                         AtomicOpsCtl: ReqEn-
                         IDOReq- IDOCompl- LTR+ EmergencyPowerReductionReq-
                         10BitTagReq- OBFF Disabled, EETLPPrefixBlk-
                LnkCap2: Supported Link Speeds: 2.5-8GT/s, Crosslink- Retimer- 2Retimers- DRS-
                LnkCtl2: Target Link Speed: 8GT/s, EnterCompliance- SpeedDis-
                         Transmit Margin: Normal Operating Range, EnterModifiedCompliance- ComplianceSOS-
                         Compliance Preset/De-emphasis: -6dB de-emphasis, 0dB preshoot
                LnkSta2: Current De-emphasis Level: -6dB, EqualizationComplete+ EqualizationPhase1+
                         EqualizationPhase2+ EqualizationPhase3+ LinkEqualizationRequest-
                         Retimer- 2Retimers- CrosslinkRes: unsupported
        Capabilities: [b0] MSI-X: Enable+ Count=8 Masked-
                Vector table: BAR=0 offset=00003000
                PBA: BAR=0 offset=00002000
        Kernel driver in use: nvme
02:00.0 Ethernet controller: Intel Corporation Ethernet Controller I226-V (rev 04)
        Subsystem: Intel Corporation Device 0000
        Control: I/O- Mem+ BusMaster+ SpecCycle- MemWINV- VGASnoop- ParErr- Stepping- SERR- FastB2B- DisINTx+
        Status: Cap+ 66MHz- UDF- FastB2B- ParErr- DEVSEL=fast >TAbort- <TAbort- <MAbort- >SERR- <PERR- INTx-
        Latency: 0, Cache Line Size: 64 bytes
        Interrupt: pin A routed to IRQ 18
        Region 0: Memory at 81600000 (32-bit, non-prefetchable) [size=1M]
        Region 3: Memory at 81700000 (32-bit, non-prefetchable) [size=16K]
        Expansion ROM at 81500000 [disabled] [size=1M]
        Capabilities: [40] Power Management version 3
                Flags: PMEClk- DSI+ D1- D2- AuxCurrent=0mA PME(D0+,D1-,D2-,D3hot+,D3cold+)
                Status: D0 NoSoftRst+ PME-Enable- DSel=0 DScale=1 PME-
        Capabilities: [50] MSI: Enable- Count=1/1 Maskable+ 64bit+
                Address: 0000000000000000  Data: 0000
                Masking: 00000000  Pending: 00000000
        Capabilities: [70] MSI-X: Enable+ Count=5 Masked-
                Vector table: BAR=3 offset=00000000
                PBA: BAR=3 offset=00002000
        Capabilities: [a0] Express (v2) Endpoint, IntMsgNum 0
                DevCap: MaxPayload 512 bytes, PhantFunc 0, Latency L0s <512ns, L1 <64us
                        ExtTag- AttnBtn- AttnInd- PwrInd- RBE+ FLReset+ SlotPowerLimit 0W TEE-IO-
                DevCtl: CorrErr- NonFatalErr- FatalErr- UnsupReq-
                        RlxdOrd+ ExtTag- PhantFunc- AuxPwr- NoSnoop+ FLReset-
                        MaxPayload 256 bytes, MaxReadReq 512 bytes
                DevSta: CorrErr- NonFatalErr- FatalErr- UnsupReq- AuxPwr+ TransPend-
                LnkCap: Port #0, Speed 5GT/s, Width x1, ASPM L1, Exit Latency L1 <4us
                        ClockPM- Surprise- LLActRep- BwNot- ASPMOptComp+
                LnkCtl: ASPM L1 Enabled; RCB 64 bytes, LnkDisable- CommClk+
                        ExtSynch- ClockPM- AutWidDis- BWInt- AutBWInt-
                LnkSta: Speed 5GT/s, Width x1
                        TrErr- Train- SlotClk+ DLActive- BWMgmt- ABWMgmt-
                DevCap2: Completion Timeout: Range ABCD, TimeoutDis+ NROPrPrP- LTR+
                         10BitTagComp- 10BitTagReq- OBFF Not Supported, ExtFmt- EETLPPrefix-
                         EmergencyPowerReduction Not Supported, EmergencyPowerReductionInit-
                         FRS- TPHComp- ExtTPHComp-
                         AtomicOpsCap: 32bit- 64bit- 128bitCAS-
                DevCtl2: Completion Timeout: 50us to 50ms, TimeoutDis-
                         AtomicOpsCtl: ReqEn-
                         IDOReq- IDOCompl- LTR+ EmergencyPowerReductionReq-
                         10BitTagReq- OBFF Disabled, EETLPPrefixBlk-
                LnkCtl2: Target Link Speed: 5GT/s, EnterCompliance- SpeedDis-
                         Transmit Margin: Normal Operating Range, EnterModifiedCompliance- ComplianceSOS-
                         Compliance Preset/De-emphasis: -6dB de-emphasis, 0dB preshoot
                LnkSta2: Current De-emphasis Level: -6dB, EqualizationComplete- EqualizationPhase1-
                         EqualizationPhase2- EqualizationPhase3- LinkEqualizationRequest-
                         Retimer- 2Retimers- CrosslinkRes: unsupported
        Kernel driver in use: igc
03:00.0 Ethernet controller: Intel Corporation Ethernet Controller I226-V (rev 04)
        Subsystem: Intel Corporation Device 0000
        Control: I/O- Mem+ BusMaster+ SpecCycle- MemWINV- VGASnoop- ParErr- Stepping- SERR- FastB2B- DisINTx+
        Status: Cap+ 66MHz- UDF- FastB2B- ParErr- DEVSEL=fast >TAbort- <TAbort- <MAbort- >SERR- <PERR- INTx-
        Latency: 0, Cache Line Size: 64 bytes
        Interrupt: pin A routed to IRQ 19
        Region 0: Memory at 81300000 (32-bit, non-prefetchable) [size=1M]
        Region 3: Memory at 81400000 (32-bit, non-prefetchable) [size=16K]
        Expansion ROM at 81200000 [disabled] [size=1M]
        Capabilities: [40] Power Management version 3
                Flags: PMEClk- DSI+ D1- D2- AuxCurrent=0mA PME(D0+,D1-,D2-,D3hot+,D3cold+)
                Status: D0 NoSoftRst+ PME-Enable- DSel=0 DScale=1 PME-
        Capabilities: [50] MSI: Enable- Count=1/1 Maskable+ 64bit+
                Address: 0000000000000000  Data: 0000
                Masking: 00000000  Pending: 00000000
        Capabilities: [70] MSI-X: Enable+ Count=5 Masked-
                Vector table: BAR=3 offset=00000000
                PBA: BAR=3 offset=00002000
        Capabilities: [a0] Express (v2) Endpoint, IntMsgNum 0
                DevCap: MaxPayload 512 bytes, PhantFunc 0, Latency L0s <512ns, L1 <64us
                        ExtTag- AttnBtn- AttnInd- PwrInd- RBE+ FLReset+ SlotPowerLimit 0W TEE-IO-
                DevCtl: CorrErr- NonFatalErr- FatalErr- UnsupReq-
                        RlxdOrd+ ExtTag- PhantFunc- AuxPwr- NoSnoop+ FLReset-
                        MaxPayload 256 bytes, MaxReadReq 512 bytes
                DevSta: CorrErr- NonFatalErr- FatalErr- UnsupReq- AuxPwr+ TransPend-
                LnkCap: Port #0, Speed 5GT/s, Width x1, ASPM L1, Exit Latency L1 <4us
                        ClockPM- Surprise- LLActRep- BwNot- ASPMOptComp+
                LnkCtl: ASPM L1 Enabled; RCB 64 bytes, LnkDisable- CommClk+
                        ExtSynch- ClockPM- AutWidDis- BWInt- AutBWInt-
                LnkSta: Speed 5GT/s, Width x1
                        TrErr- Train- SlotClk+ DLActive- BWMgmt- ABWMgmt-
                DevCap2: Completion Timeout: Range ABCD, TimeoutDis+ NROPrPrP- LTR+
                         10BitTagComp- 10BitTagReq- OBFF Not Supported, ExtFmt- EETLPPrefix-
                         EmergencyPowerReduction Not Supported, EmergencyPowerReductionInit-
                         FRS- TPHComp- ExtTPHComp-
                         AtomicOpsCap: 32bit- 64bit- 128bitCAS-
                DevCtl2: Completion Timeout: 50us to 50ms, TimeoutDis-
                         AtomicOpsCtl: ReqEn-
                         IDOReq- IDOCompl- LTR+ EmergencyPowerReductionReq-
                         10BitTagReq- OBFF Disabled, EETLPPrefixBlk-
                LnkCtl2: Target Link Speed: 5GT/s, EnterCompliance- SpeedDis-
                         Transmit Margin: Normal Operating Range, EnterModifiedCompliance- ComplianceSOS-
                         Compliance Preset/De-emphasis: -6dB de-emphasis, 0dB preshoot
                LnkSta2: Current De-emphasis Level: -6dB, EqualizationComplete- EqualizationPhase1-
                         EqualizationPhase2- EqualizationPhase3- LinkEqualizationRequest-
                         Retimer- 2Retimers- CrosslinkRes: unsupported
        Kernel driver in use: igc
04:00.0 Ethernet controller: Aquantia Corp. AQC113C NBase-T/IEEE 802.3an Ethernet Controller [Marvell Scalable mGig] (rev 03)
        Subsystem: Aquantia Corp. Device 0001
        Control: I/O- Mem+ BusMaster+ SpecCycle- MemWINV- VGASnoop- ParErr- Stepping- SERR- FastB2B- DisINTx+
        Status: Cap+ 66MHz- UDF- FastB2B- ParErr- DEVSEL=fast >TAbort- <TAbort- <MAbort- >SERR- <PERR- INTx-
        Latency: 0, Cache Line Size: 64 bytes
        Interrupt: pin A routed to IRQ 16
        Region 0: Memory at 81000000 (64-bit, non-prefetchable) [size=512K]
        Region 2: Memory at 810a0000 (64-bit, non-prefetchable) [size=4K]
        Region 4: Memory at 80c00000 (64-bit, non-prefetchable) [size=4M]
        Expansion ROM at 81080000 [disabled] [size=128K]
        Capabilities: [40] Power Management version 3
                Flags: PMEClk- DSI- D1+ D2+ AuxCurrent=375mA PME(D0+,D1+,D2-,D3hot+,D3cold+)
                Status: D0 NoSoftRst+ PME-Enable- DSel=0 DScale=0 PME-
        Capabilities: [50] MSI: Enable- Count=1/32 Maskable+ 64bit+
                Address: 0000000000000000  Data: 0000
                Masking: 00000000  Pending: 00000000
        Capabilities: [70] Express (v2) Endpoint, IntMsgNum 0
                DevCap: MaxPayload 512 bytes, PhantFunc 0, Latency L0s unlimited, L1 unlimited
                        ExtTag+ AttnBtn- AttnInd- PwrInd- RBE+ FLReset+ SlotPowerLimit 25W TEE-IO-
                DevCtl: CorrErr- NonFatalErr- FatalErr- UnsupReq-
                        RlxdOrd+ ExtTag+ PhantFunc- AuxPwr- NoSnoop+ FLReset-
                        MaxPayload 256 bytes, MaxReadReq 512 bytes
                DevSta: CorrErr- NonFatalErr- FatalErr- UnsupReq- AuxPwr+ TransPend-
                LnkCap: Port #0, Speed 8GT/s, Width x2, ASPM L0s L1, Exit Latency L0s <4us, L1 <64us
                        ClockPM+ Surprise- LLActRep- BwNot- ASPMOptComp+
                LnkCtl: ASPM L1 Enabled; RCB 64 bytes, LnkDisable- CommClk+
                        ExtSynch- ClockPM+ AutWidDis- BWInt- AutBWInt-
                LnkSta: Speed 8GT/s, Width x2
                        TrErr- Train- SlotClk+ DLActive- BWMgmt- ABWMgmt-
                DevCap2: Completion Timeout: Not Supported, TimeoutDis+ NROPrPrP- LTR+
                         10BitTagComp+ 10BitTagReq- OBFF Via message/WAKE#, ExtFmt- EETLPPrefix-
                         EmergencyPowerReduction Not Supported, EmergencyPowerReductionInit-
                         FRS- TPHComp- ExtTPHComp-
                         AtomicOpsCap: 32bit- 64bit- 128bitCAS-
                DevCtl2: Completion Timeout: 50us to 50ms, TimeoutDis-
                         AtomicOpsCtl: ReqEn-
                         IDOReq- IDOCompl- LTR+ EmergencyPowerReductionReq-
                         10BitTagReq- OBFF Disabled, EETLPPrefixBlk-
                LnkCap2: Supported Link Speeds: 2.5-8GT/s, Crosslink- Retimer+ 2Retimers+ DRS-
                LnkCtl2: Target Link Speed: 8GT/s, EnterCompliance- SpeedDis-
                         Transmit Margin: Normal Operating Range, EnterModifiedCompliance- ComplianceSOS-
                         Compliance Preset/De-emphasis: -6dB de-emphasis, 0dB preshoot
                LnkSta2: Current De-emphasis Level: -6dB, EqualizationComplete+ EqualizationPhase1+
                         EqualizationPhase2+ EqualizationPhase3+ LinkEqualizationRequest-
                         Retimer- 2Retimers- CrosslinkRes: Upstream Port
        Capabilities: [b0] MSI-X: Enable+ Count=32 Masked-
                Vector table: BAR=2 offset=00000000
                PBA: BAR=2 offset=00000200
        Capabilities: [d0] Vital Product Data
                Product Name: Marvell AQtion Network Adapter
                Read-only fields:
                        [PN] Part number: 00B1A113
                        [V0] Vendor specific: MAC Addr: 00:E2:69:98:A8:F0
                        [V1] Vendor specific: Bundle Version: 1.3.33
                        [V2] Vendor specific: Fw Version: 1.0.121
                        [RV] Reserved: checksum good, 0 byte(s) reserved
                End
        Kernel driver in use: atlantic
05:00.0 Ethernet controller: Aquantia Corp. AQC113C NBase-T/IEEE 802.3an Ethernet Controller [Marvell Scalable mGig] (rev 03)
        Subsystem: Aquantia Corp. Device 0001
        Control: I/O- Mem+ BusMaster+ SpecCycle- MemWINV- VGASnoop- ParErr- Stepping- SERR- FastB2B- DisINTx+
        Status: Cap+ 66MHz- UDF- FastB2B- ParErr- DEVSEL=fast >TAbort- <TAbort- <MAbort- >SERR- <PERR- INTx-
        Latency: 0, Cache Line Size: 64 bytes
        Interrupt: pin A routed to IRQ 18
        Region 0: Memory at 80800000 (64-bit, non-prefetchable) [size=512K]
        Region 2: Memory at 808a0000 (64-bit, non-prefetchable) [size=4K]
        Region 4: Memory at 80400000 (64-bit, non-prefetchable) [size=4M]
        Expansion ROM at 80880000 [disabled] [size=128K]
        Capabilities: [40] Power Management version 3
                Flags: PMEClk- DSI- D1+ D2+ AuxCurrent=375mA PME(D0+,D1+,D2-,D3hot+,D3cold+)
                Status: D0 NoSoftRst+ PME-Enable- DSel=0 DScale=0 PME-
        Capabilities: [50] MSI: Enable- Count=1/32 Maskable+ 64bit+
                Address: 0000000000000000  Data: 0000
                Masking: 00000000  Pending: 00000000
        Capabilities: [70] Express (v2) Endpoint, IntMsgNum 0
                DevCap: MaxPayload 512 bytes, PhantFunc 0, Latency L0s unlimited, L1 unlimited
                        ExtTag+ AttnBtn- AttnInd- PwrInd- RBE+ FLReset+ SlotPowerLimit 25W TEE-IO-
                DevCtl: CorrErr- NonFatalErr- FatalErr- UnsupReq-
                        RlxdOrd+ ExtTag+ PhantFunc- AuxPwr- NoSnoop+ FLReset-
                        MaxPayload 256 bytes, MaxReadReq 512 bytes
                DevSta: CorrErr- NonFatalErr- FatalErr- UnsupReq- AuxPwr+ TransPend-
                LnkCap: Port #0, Speed 8GT/s, Width x2, ASPM L0s L1, Exit Latency L0s <4us, L1 <64us
                        ClockPM+ Surprise- LLActRep- BwNot- ASPMOptComp+
                LnkCtl: ASPM L1 Enabled; RCB 64 bytes, LnkDisable- CommClk+
                        ExtSynch- ClockPM+ AutWidDis- BWInt- AutBWInt-
                LnkSta: Speed 8GT/s, Width x2
                        TrErr- Train- SlotClk+ DLActive- BWMgmt- ABWMgmt-
                DevCap2: Completion Timeout: Not Supported, TimeoutDis+ NROPrPrP- LTR+
                         10BitTagComp+ 10BitTagReq- OBFF Via message/WAKE#, ExtFmt- EETLPPrefix-
                         EmergencyPowerReduction Not Supported, EmergencyPowerReductionInit-
                         FRS- TPHComp- ExtTPHComp-
                         AtomicOpsCap: 32bit- 64bit- 128bitCAS-
                DevCtl2: Completion Timeout: 50us to 50ms, TimeoutDis-
                         AtomicOpsCtl: ReqEn-
                         IDOReq- IDOCompl- LTR+ EmergencyPowerReductionReq-
                         10BitTagReq- OBFF Disabled, EETLPPrefixBlk-
                LnkCap2: Supported Link Speeds: 2.5-8GT/s, Crosslink- Retimer+ 2Retimers+ DRS-
                LnkCtl2: Target Link Speed: 8GT/s, EnterCompliance- SpeedDis-
                         Transmit Margin: Normal Operating Range, EnterModifiedCompliance- ComplianceSOS-
                         Compliance Preset/De-emphasis: -6dB de-emphasis, 0dB preshoot
                LnkSta2: Current De-emphasis Level: -6dB, EqualizationComplete+ EqualizationPhase1+
                         EqualizationPhase2+ EqualizationPhase3+ LinkEqualizationRequest-
                         Retimer- 2Retimers- CrosslinkRes: Upstream Port
        Capabilities: [b0] MSI-X: Enable+ Count=32 Masked-
                Vector table: BAR=2 offset=00000000
                PBA: BAR=2 offset=00000200
        Capabilities: [d0] Vital Product Data
                Product Name: Marvell AQtion Network Adapter
                Read-only fields:
                        [PN] Part number: 00B1A113
                        [V0] Vendor specific: MAC Addr: 00:E2:69:98:A8:F1
                        [V1] Vendor specific: Bundle Version: 1.3.33
                        [V2] Vendor specific: Fw Version: 1.0.121
                        [RV] Reserved: checksum good, 0 byte(s) reserved
                End
        Kernel driver in use: atlantic

